{
  "schemaId": "ipt.lifecycle-state",
  "schemaVersion": "1.0.0",
  "taskId": "BOOT-003",
  "currentState": "IN_DEVELOPMENT",
  "history": [
    {
      "eventId": "evt-1",
      "fromState": "ASSIGNED",
      "toState": "IN_DEVELOPMENT",
      "occurredAt": "2026-09-02T18:00:00Z",
      "reason": "Implementation started.",
      "revisionIdentity": "abc123"
    }
  ]
}
